{
  "name": "ICE40 HX8 KBEVN",
  "class_name": "ICE40HX8KBEVNPlatform",
  "vendor": "Lattice",
  "device": "iCE40HX8K",
  "package": "CT256",
  "clocks": [
    12000000.0
  ],
  "default_clock_hz": 12000000.0,
  "leds": [
    {
      "name": "led",
      "number": 0,
      "pins": [
        "C3"
      ],
      "direction": "o",
      "inverted": false,
      "connector": null,
      "attrs": {
        "IO_STANDARD": "SB_LVCMOS"
      }
    },
    {
      "name": "led",
      "number": 1,
      "pins": [
        "B3"
      ],
      "direction": "o",
      "inverted": false,
      "connector": null,
      "attrs": {
        "IO_STANDARD": "SB_LVCMOS"
      }
    },
    {
      "name": "led",
      "number": 2,
      "pins": [
        "C4"
      ],
      "direction": "o",
      "inverted": false,
      "connector": null,
      "attrs": {
        "IO_STANDARD": "SB_LVCMOS"
      }
    },
    {
      "name": "led",
      "number": 3,
      "pins": [
        "C5"
      ],
      "direction": "o",
      "inverted": false,
      "connector": null,
      "attrs": {
        "IO_STANDARD": "SB_LVCMOS"
      }
    },
    {
      "name": "led",
      "number": 4,
      "pins": [
        "A1"
      ],
      "direction": "o",
      "inverted": false,
      "connector": null,
      "attrs": {
        "IO_STANDARD": "SB_LVCMOS"
      }
    },
    {
      "name": "led",
      "number": 5,
      "pins": [
        "A2"
      ],
      "direction": "o",
      "inverted": false,
      "connector": null,
      "attrs": {
        "IO_STANDARD": "SB_LVCMOS"
      }
    },
    {
      "name": "led",
      "number": 6,
      "pins": [
        "B4"
      ],
      "direction": "o",
      "inverted": false,
      "connector": null,
      "attrs": {
        "IO_STANDARD": "SB_LVCMOS"
      }
    },
    {
      "name": "led",
      "number": 7,
      "pins": [
        "B5"
      ],
      "direction": "o",
      "inverted": false,
      "connector": null,
      "attrs": {
        "IO_STANDARD": "SB_LVCMOS"
      }
    }
  ],
  "buttons": [],
  "switches": [],
  "seven_seg": null,
  "port_conventions": {
    "amaranth": {
      "description": "amaranth-boards platform port names (auto-derived from the board .py file)",
      "clk": "clk12",
      "leds": {
        "name": "led",
        "width": 8
      },
      "naming": "framework-derived"
    }
  },
  "$schema": "../schema/board.schema.json",
  "source": {
    "origin": "amaranth-boards",
    "upstream_file": "ice40_hx8k_b_evn.py",
    "upstream_class": "ICE40HX8KBEVNPlatform",
    "sync_commit": "be069dfd490b31df215337afac35711994a52418",
    "sync_timestamp": "2026-10-31T23:32:50.118937+00:00"
  }
}
