{
  "name": "Efinix T8f81 Dev Kit",
  "class_name": "EfinixT8f81DevKitPlatform",
  "vendor": "Efinix",
  "device": "T8F81C2",
  "package": "",
  "clocks": [
    {
      "name": "clk33",
      "hz": 33333000.0,
      "pin": "C3",
      "is_default": true
    }
  ],
  "default_clock_hz": 33333000.0,
  "leds": [
    {
      "name": "led",
      "number": 0,
      "pins": [
        "G4"
      ],
      "direction": "o",
      "inverted": false,
      "connector": null,
      "attrs": {
        "IOSTANDARD": "3.3_V_LVTTL_/_LVCMOS"
      }
    },
    {
      "name": "led",
      "number": 1,
      "pins": [
        "J2"
      ],
      "direction": "o",
      "inverted": false,
      "connector": null,
      "attrs": {
        "IOSTANDARD": "3.3_V_LVTTL_/_LVCMOS"
      }
    },
    {
      "name": "led",
      "number": 2,
      "pins": [
        "C2"
      ],
      "direction": "o",
      "inverted": false,
      "connector": null,
      "attrs": {
        "IOSTANDARD": "3.3_V_LVTTL_/_LVCMOS"
      }
    },
    {
      "name": "led",
      "number": 3,
      "pins": [
        "E3"
      ],
      "direction": "o",
      "inverted": false,
      "connector": null,
      "attrs": {
        "IOSTANDARD": "3.3_V_LVTTL_/_LVCMOS"
      }
    },
    {
      "name": "led",
      "number": 4,
      "pins": [
        "B3"
      ],
      "direction": "o",
      "inverted": false,
      "connector": null,
      "attrs": {
        "IOSTANDARD": "3.3_V_LVTTL_/_LVCMOS"
      }
    }
  ],
  "buttons": [
    {
      "name": "button__n",
      "number": 0,
      "pins": [
        "G1"
      ],
      "direction": "i",
      "inverted": false,
      "connector": null,
      "attrs": {
        "IOSTANDARD": "3.3_V_LVTTL_/_LVCMOS"
      }
    },
    {
      "name": "button__n",
      "number": 1,
      "pins": [
        "F1"
      ],
      "direction": "i",
      "inverted": false,
      "connector": null,
      "attrs": {
        "IOSTANDARD": "3.3_V_LVTTL_/_LVCMOS"
      }
    }
  ],
  "switches": [],
  "seven_seg": null,
  "port_conventions": {
    "litex": {
      "description": "LiteX platform port names (auto-derived from the litex-boards _io file)",
      "clk": "clk33",
      "leds": {
        "name": "user_led",
        "width": 5
      },
      "naming": "framework-derived",
      "buttons": {
        "name": "user_btn_n",
        "width": 2,
        "active_low": true
      }
    }
  },
  "$schema": "../schema/board.schema.json",
  "source": {
    "origin": "litex-boards",
    "upstream_file": "efinix_t8f81_dev_kit.py",
    "upstream_class": "Platform",
    "sync_commit": "8bf5de766fed9b89fdb265b17d2becc08039e9d1",
    "sync_timestamp": "2026-10-31T23:32:51.652149+00:00",
    "upstream_status": "orphaned",
    "orphaned_at_commit": "97186cfc90cca23baa34680c520d2c04bbf6b828",
    "orphaned_at_date": "2026-11-01",
    "orphaned_reason": "file_removed",
    "successor": "litex-boards/efinix_t8_f81_dev_kit.json"
  }
}
