{
  "name": "Alinx Ax7035",
  "class_name": "AlinxAx7035Platform",
  "vendor": "Xilinx",
  "device": "xc7a35t-fgg484-2",
  "package": "",
  "clocks": [
    {
      "name": "clk50",
      "hz": 50000000.0,
      "pin": "Y18",
      "is_default": true
    }
  ],
  "default_clock_hz": 50000000.0,
  "leds": [
    {
      "name": "led",
      "number": 0,
      "pins": [
        "F19"
      ],
      "direction": "o",
      "inverted": false,
      "connector": null,
      "attrs": {
        "IOSTANDARD": "LVCMOS33"
      }
    },
    {
      "name": "led",
      "number": 1,
      "pins": [
        "E21"
      ],
      "direction": "o",
      "inverted": false,
      "connector": null,
      "attrs": {
        "IOSTANDARD": "LVCMOS33"
      }
    },
    {
      "name": "led",
      "number": 2,
      "pins": [
        "D20"
      ],
      "direction": "o",
      "inverted": false,
      "connector": null,
      "attrs": {
        "IOSTANDARD": "LVCMOS33"
      }
    },
    {
      "name": "led",
      "number": 3,
      "pins": [
        "C20"
      ],
      "direction": "o",
      "inverted": false,
      "connector": null,
      "attrs": {
        "IOSTANDARD": "LVCMOS33"
      }
    }
  ],
  "buttons": [
    {
      "name": "button",
      "number": 0,
      "pins": [
        "M13"
      ],
      "direction": "i",
      "inverted": false,
      "connector": null,
      "attrs": {
        "IOSTANDARD": "LVCMOS33"
      }
    },
    {
      "name": "button",
      "number": 1,
      "pins": [
        "K14"
      ],
      "direction": "i",
      "inverted": false,
      "connector": null,
      "attrs": {
        "IOSTANDARD": "LVCMOS33"
      }
    },
    {
      "name": "button",
      "number": 2,
      "pins": [
        "K13"
      ],
      "direction": "i",
      "inverted": false,
      "connector": null,
      "attrs": {
        "IOSTANDARD": "LVCMOS33"
      }
    },
    {
      "name": "button",
      "number": 3,
      "pins": [
        "L13"
      ],
      "direction": "i",
      "inverted": false,
      "connector": null,
      "attrs": {
        "IOSTANDARD": "LVCMOS33"
      }
    }
  ],
  "switches": [],
  "seven_seg": {
    "num_digits": 1,
    "has_dp": false,
    "is_multiplexed": false,
    "inverted": false,
    "select_inverted": false
  },
  "port_conventions": {
    "litex": {
      "description": "LiteX platform port names (auto-derived from the litex-boards _io file)",
      "clk": "clk50",
      "leds": {
        "name": "user_led",
        "width": 4
      },
      "naming": "framework-derived",
      "buttons": {
        "name": "user_btn",
        "width": 4
      }
    }
  },
  "$schema": "../schema/board.schema.json",
  "source": {
    "origin": "litex-boards",
    "upstream_file": "alinx_ax7035.py",
    "upstream_class": "Platform",
    "sync_commit": "97186cfc90cca23baa34680c520d2c04bbf6b828",
    "sync_timestamp": "2026-11-01T22:24:43.342916+00:00"
  }
}
