{
  "name": "Lckfb Ljpi",
  "class_name": "LckfbLjpiPlatform",
  "vendor": "Gowin",
  "device": "",
  "package": "",
  "clocks": [
    {
      "name": "clk50",
      "hz": 50000000.0,
      "pin": "T7",
      "is_default": true
    }
  ],
  "default_clock_hz": 50000000.0,
  "leds": [
    {
      "name": "led",
      "number": 0,
      "pins": [
        "R9"
      ],
      "direction": "o",
      "inverted": false,
      "connector": null,
      "attrs": {
        "IOSTANDARD": "LVCMOS33"
      }
    },
    {
      "name": "led",
      "number": 1,
      "pins": [
        "C10"
      ],
      "direction": "o",
      "inverted": false,
      "connector": null,
      "attrs": {
        "IOSTANDARD": "LVCMOS33"
      }
    },
    {
      "name": "led",
      "number": 2,
      "pins": [
        "N6"
      ],
      "direction": "o",
      "inverted": false,
      "connector": null,
      "attrs": {
        "IOSTANDARD": "LVCMOS33"
      }
    },
    {
      "name": "led",
      "number": 3,
      "pins": [
        "R7"
      ],
      "direction": "o",
      "inverted": false,
      "connector": null,
      "attrs": {
        "IOSTANDARD": "LVCMOS33"
      }
    },
    {
      "name": "led",
      "number": 4,
      "pins": [
        "T10"
      ],
      "direction": "o",
      "inverted": false,
      "connector": null,
      "attrs": {
        "IOSTANDARD": "LVCMOS33"
      }
    },
    {
      "name": "led",
      "number": 5,
      "pins": [
        "P7"
      ],
      "direction": "o",
      "inverted": false,
      "connector": null,
      "attrs": {
        "IOSTANDARD": "LVCMOS33"
      }
    }
  ],
  "buttons": [
    {
      "name": "button",
      "number": 0,
      "pins": [
        "D11"
      ],
      "direction": "i",
      "inverted": false,
      "connector": null,
      "attrs": {
        "IOSTANDARD": "LVCMOS33"
      }
    }
  ],
  "switches": [],
  "seven_seg": null,
  "port_conventions": {
    "litex": {
      "description": "LiteX platform port names (auto-derived from the litex-boards _io file)",
      "clk": "clk50",
      "leds": {
        "name": "led",
        "width": 6
      },
      "naming": "framework-derived",
      "buttons": {
        "name": "btn_n",
        "width": 1,
        "active_low": true
      }
    }
  },
  "$schema": "../schema/board.schema.json",
  "source": {
    "origin": "litex-boards",
    "upstream_file": "lckfb_ljpi.py",
    "upstream_class": "Platform",
    "sync_commit": "8bf5de766fed9b89fdb265b17d2becc08039e9d1",
    "sync_timestamp": "2026-10-31T23:32:51.652149+00:00"
  }
}
