{
  "name": "Mlk Cu07 Ku15p",
  "class_name": "MlkCu07Ku15pPlatform",
  "vendor": "Xilinx",
  "device": "xcku15p-ffva1156-2-e",
  "package": "",
  "clocks": [
    {
      "name": "clk100",
      "hz": 100000000.0,
      "pin": "AH18",
      "is_default": true
    },
    {
      "name": "clk100_ddr",
      "hz": 100000000.0,
      "pin": "AK17"
    }
  ],
  "default_clock_hz": 100000000.0,
  "leds": [
    {
      "name": "led",
      "number": 0,
      "pins": [
        "AP9"
      ],
      "direction": "o",
      "inverted": false,
      "connector": null,
      "attrs": {
        "IOSTANDARD": "LVCMOS33"
      }
    },
    {
      "name": "led",
      "number": 1,
      "pins": [
        "AN9"
      ],
      "direction": "o",
      "inverted": false,
      "connector": null,
      "attrs": {
        "IOSTANDARD": "LVCMOS33"
      }
    },
    {
      "name": "led",
      "number": 2,
      "pins": [
        "AP8"
      ],
      "direction": "o",
      "inverted": false,
      "connector": null,
      "attrs": {
        "IOSTANDARD": "LVCMOS33"
      }
    },
    {
      "name": "led",
      "number": 3,
      "pins": [
        "AN8"
      ],
      "direction": "o",
      "inverted": false,
      "connector": null,
      "attrs": {
        "IOSTANDARD": "LVCMOS33"
      }
    },
    {
      "name": "led",
      "number": 4,
      "pins": [
        "AL10"
      ],
      "direction": "o",
      "inverted": false,
      "connector": null,
      "attrs": {
        "IOSTANDARD": "LVCMOS33"
      }
    },
    {
      "name": "led",
      "number": 5,
      "pins": [
        "AM10"
      ],
      "direction": "o",
      "inverted": false,
      "connector": null,
      "attrs": {
        "IOSTANDARD": "LVCMOS33"
      }
    },
    {
      "name": "led",
      "number": 6,
      "pins": [
        "AE11"
      ],
      "direction": "o",
      "inverted": false,
      "connector": null,
      "attrs": {
        "IOSTANDARD": "LVCMOS33"
      }
    }
  ],
  "buttons": [
    {
      "name": "button",
      "number": 0,
      "pins": [
        "G26"
      ],
      "direction": "i",
      "inverted": false,
      "connector": null,
      "attrs": {
        "IOSTANDARD": "LVCMOS18"
      }
    },
    {
      "name": "button",
      "number": 1,
      "pins": [
        "G25"
      ],
      "direction": "i",
      "inverted": false,
      "connector": null,
      "attrs": {
        "IOSTANDARD": "LVCMOS18"
      }
    },
    {
      "name": "button",
      "number": 2,
      "pins": [
        "H24"
      ],
      "direction": "i",
      "inverted": false,
      "connector": null,
      "attrs": {
        "IOSTANDARD": "LVCMOS18"
      }
    }
  ],
  "switches": [],
  "seven_seg": null,
  "port_conventions": {
    "litex": {
      "description": "LiteX platform port names (auto-derived from the litex-boards _io file)",
      "clk": "clk100",
      "leds": {
        "name": "user_led",
        "width": 7
      },
      "naming": "framework-derived",
      "buttons": {
        "name": "user_btn",
        "width": 3
      }
    }
  },
  "$schema": "../schema/board.schema.json",
  "source": {
    "origin": "litex-boards",
    "upstream_file": "mlk_cu07_ku15p.py",
    "upstream_class": "Platform",
    "sync_commit": "97186cfc90cca23baa34680c520d2c04bbf6b828",
    "sync_timestamp": "2026-11-01T22:24:43.342916+00:00"
  }
}
