{
  "name": "Alchitry Au",
  "class_name": "AlchitryAuPlatform",
  "vendor": "Xilinx",
  "device": "XC7A35T",
  "package": "FTG256",
  "clocks": [
    100000000.0
  ],
  "default_clock_hz": 100000000.0,
  "leds": [
    {
      "name": "led",
      "number": 0,
      "pins": [
        "K13"
      ],
      "direction": "o",
      "inverted": false,
      "connector": null,
      "attrs": {
        "IOSTANDARD": "LVCMOS33"
      }
    },
    {
      "name": "led",
      "number": 1,
      "pins": [
        "K12"
      ],
      "direction": "o",
      "inverted": false,
      "connector": null,
      "attrs": {
        "IOSTANDARD": "LVCMOS33"
      }
    },
    {
      "name": "led",
      "number": 2,
      "pins": [
        "L14"
      ],
      "direction": "o",
      "inverted": false,
      "connector": null,
      "attrs": {
        "IOSTANDARD": "LVCMOS33"
      }
    },
    {
      "name": "led",
      "number": 3,
      "pins": [
        "L13"
      ],
      "direction": "o",
      "inverted": false,
      "connector": null,
      "attrs": {
        "IOSTANDARD": "LVCMOS33"
      }
    },
    {
      "name": "led",
      "number": 4,
      "pins": [
        "M16"
      ],
      "direction": "o",
      "inverted": false,
      "connector": null,
      "attrs": {
        "IOSTANDARD": "LVCMOS33"
      }
    },
    {
      "name": "led",
      "number": 5,
      "pins": [
        "M14"
      ],
      "direction": "o",
      "inverted": false,
      "connector": null,
      "attrs": {
        "IOSTANDARD": "LVCMOS33"
      }
    },
    {
      "name": "led",
      "number": 6,
      "pins": [
        "M12"
      ],
      "direction": "o",
      "inverted": false,
      "connector": null,
      "attrs": {
        "IOSTANDARD": "LVCMOS33"
      }
    },
    {
      "name": "led",
      "number": 7,
      "pins": [
        "N16"
      ],
      "direction": "o",
      "inverted": false,
      "connector": null,
      "attrs": {
        "IOSTANDARD": "LVCMOS33"
      }
    }
  ],
  "buttons": [],
  "switches": [],
  "seven_seg": null,
  "port_conventions": {
    "amaranth": {
      "description": "amaranth-boards platform port names (auto-derived from the board .py file)",
      "clk": "clk100",
      "leds": {
        "name": "led",
        "width": 8
      },
      "naming": "framework-derived"
    },
    "alchitry": {
      "clk": "clk",
      "leds": {
        "name": "led",
        "width": 8
      },
      "description": "Researched inline via GitHub API 2026-07-11 (batch b11; agent died on session limit). One physical board; row covers the amaranth and litex files.",
      "naming": "canonical",
      "source": {
        "url": "https://raw.githubusercontent.com/alchitry/Au-Base-Project/e27480fa5d1ee6dda1e7b28846c6f886bd778312/au_base_project.srcs/constrs_1/new/au.xdc",
        "content_sha256": "a44486a5aec29330dee5908a4ac964ffe331730dc62181c3486e51a30ff5f2ad",
        "retrieved": "2026-07-28",
        "registry_board": "Alchitry Au"
      }
    }
  },
  "$schema": "../schema/board.schema.json",
  "source": {
    "origin": "amaranth-boards",
    "upstream_file": "alchitry_au.py",
    "upstream_class": "AlchitryAuPlatform",
    "sync_commit": "be069dfd490b31df215337afac35711994a52418",
    "sync_timestamp": "2026-10-31T23:32:50.118937+00:00"
  }
}
