{
  "name": "Trenz S7mini",
  "class_name": "TrenzS7miniPlatform",
  "vendor": "Xilinx",
  "device": "",
  "package": "",
  "clocks": [
    {
      "name": "clk100",
      "hz": 100000000.0,
      "pin": "L5",
      "is_default": true
    }
  ],
  "default_clock_hz": 100000000.0,
  "leds": [
    {
      "name": "led",
      "number": 0,
      "pins": [
        "D14"
      ],
      "direction": "o",
      "inverted": false,
      "connector": null,
      "attrs": {
        "IOSTANDARD": "LVCMOS33"
      }
    },
    {
      "name": "led",
      "number": 1,
      "pins": [
        "C14"
      ],
      "direction": "o",
      "inverted": false,
      "connector": null,
      "attrs": {
        "IOSTANDARD": "LVCMOS33"
      }
    }
  ],
  "buttons": [
    {
      "name": "button",
      "number": 0,
      "pins": [
        "A4"
      ],
      "direction": "i",
      "inverted": false,
      "connector": null,
      "attrs": {
        "IOSTANDARD": "LVCMOS33"
      }
    }
  ],
  "switches": [
    {
      "name": "switch",
      "number": 0,
      "pins": [
        "D3"
      ],
      "direction": "i",
      "inverted": false,
      "connector": null,
      "attrs": {
        "IOSTANDARD": "LVCMOS33"
      }
    }
  ],
  "seven_seg": null,
  "port_conventions": {
    "litex": {
      "description": "LiteX platform port names (auto-derived from the litex-boards _io file)",
      "clk": "clk100",
      "leds": {
        "name": "user_led",
        "width": 2
      },
      "naming": "framework-derived",
      "switches": {
        "name": "user_sw",
        "width": 1
      },
      "buttons": {
        "name": "user_btn",
        "width": 1
      }
    }
  },
  "$schema": "../schema/board.schema.json",
  "source": {
    "origin": "litex-boards",
    "upstream_file": "trenz_s7mini.py",
    "upstream_class": "Platform",
    "upstream_args": {
      "variant": "s7-25"
    },
    "sync_commit": "8bf5de766fed9b89fdb265b17d2becc08039e9d1",
    "sync_timestamp": "2026-10-31T23:32:51.652149+00:00"
  }
}
