{
  "name": "Fairwaves Xtrx",
  "class_name": "FairwavesXtrxPlatform",
  "vendor": "Xilinx",
  "device": "xc7a50tcpg236-2",
  "package": "",
  "clocks": [
    {
      "name": "clk60",
      "hz": 59999999.99999999,
      "pin": "C16",
      "is_default": true
    }
  ],
  "default_clock_hz": 59999999.99999999,
  "leds": [
    {
      "name": "led",
      "number": 0,
      "pins": [
        "N18"
      ],
      "direction": "o",
      "inverted": false,
      "connector": null,
      "attrs": {
        "IOSTANDARD": "LVCMOS25"
      }
    },
    {
      "name": "led",
      "number": 0,
      "pins": [
        "G3",
        "M2",
        "G2"
      ],
      "direction": "o",
      "inverted": false,
      "connector": null,
      "attrs": {
        "IOSTANDARD": "LVCMOS33"
      }
    }
  ],
  "buttons": [],
  "switches": [],
  "seven_seg": null,
  "port_conventions": {
    "litex": {
      "description": "LiteX platform port names (auto-derived from the litex-boards _io file)",
      "clk": "clk60",
      "leds": {
        "name": "user_led",
        "width": 1
      },
      "naming": "framework-derived"
    }
  },
  "$schema": "../schema/board.schema.json",
  "source": {
    "origin": "litex-boards",
    "upstream_file": "fairwaves_xtrx.py",
    "upstream_class": "Platform",
    "upstream_args": {
      "variant": "xc7a50t"
    },
    "sync_commit": "8bf5de766fed9b89fdb265b17d2becc08039e9d1",
    "sync_timestamp": "2026-11-01T03:02:02.821936+00:00"
  }
}
