{
  "$schema": "../schema/board.schema.json",
  "name": "Cora Z7-07S",
  "class_name": "CoraZ707SPlatform",
  "vendor": "Xilinx",
  "device": "xc7z007s",
  "package": "clg400",
  "clocks": [],
  "default_clock_hz": 125000000.0,
  "leds": [
    {
      "name": "rgb_led",
      "number": 0,
      "pins": [
        "N15",
        "G17",
        "L15"
      ],
      "direction": "o",
      "inverted": false,
      "connector": null,
      "attrs": {
        "IOSTANDARD": "LVCMOS33"
      }
    },
    {
      "name": "rgb_led",
      "number": 1,
      "pins": [
        "M15",
        "L14",
        "G14"
      ],
      "direction": "o",
      "inverted": false,
      "connector": null,
      "attrs": {
        "IOSTANDARD": "LVCMOS33"
      }
    }
  ],
  "buttons": [
    {
      "name": "button",
      "number": 0,
      "pins": [
        "D20"
      ],
      "direction": "i",
      "inverted": false,
      "connector": null,
      "attrs": {
        "IOSTANDARD": "LVCMOS33"
      }
    },
    {
      "name": "button",
      "number": 1,
      "pins": [
        "D19"
      ],
      "direction": "i",
      "inverted": false,
      "connector": null,
      "attrs": {
        "IOSTANDARD": "LVCMOS33"
      }
    }
  ],
  "switches": [],
  "seven_seg": null,
  "source": {
    "origin": "digilent-xdc",
    "upstream_file": "Cora-Z7-07S-Master.xdc",
    "sync_commit": "00a3404901f35aa9567b01ecb3f2c233b6efe9f4",
    "sync_timestamp": "2026-05-25T04:03:40.978747+00:00"
  },
  "port_conventions": {
    "digilent": {
      "description": "Digilent Cora-Z7-07S Master XDC port names",
      "buttons": {
        "name": "btn",
        "width": 2,
        "active_low": false
      }
    }
  }
}
