{
  "name": "Sitlinv Xc7k420t",
  "class_name": "SitlinvXc7k420tPlatform",
  "vendor": "Xilinx",
  "device": "xc7k420t-ffg901-2",
  "package": "",
  "clocks": [
    {
      "name": "clk100",
      "hz": 100000000.0,
      "pin": "U24",
      "is_default": true
    }
  ],
  "default_clock_hz": 100000000.0,
  "leds": [
    {
      "name": "led",
      "number": 0,
      "pins": [
        "A27"
      ],
      "direction": "o",
      "inverted": false,
      "connector": null,
      "attrs": {
        "IOSTANDARD": "LVCMOS15"
      }
    },
    {
      "name": "led",
      "number": 1,
      "pins": [
        "E24"
      ],
      "direction": "o",
      "inverted": false,
      "connector": null,
      "attrs": {
        "IOSTANDARD": "LVCMOS15"
      }
    },
    {
      "name": "led",
      "number": 2,
      "pins": [
        "G24"
      ],
      "direction": "o",
      "inverted": false,
      "connector": null,
      "attrs": {
        "IOSTANDARD": "LVCMOS15"
      }
    },
    {
      "name": "led",
      "number": 3,
      "pins": [
        "H21"
      ],
      "direction": "o",
      "inverted": false,
      "connector": null,
      "attrs": {
        "IOSTANDARD": "LVCMOS15"
      }
    },
    {
      "name": "led",
      "number": 4,
      "pins": [
        "G27"
      ],
      "direction": "o",
      "inverted": false,
      "connector": null,
      "attrs": {
        "IOSTANDARD": "LVCMOS15"
      }
    },
    {
      "name": "led",
      "number": 5,
      "pins": [
        "H26"
      ],
      "direction": "o",
      "inverted": false,
      "connector": null,
      "attrs": {
        "IOSTANDARD": "LVCMOS15"
      }
    },
    {
      "name": "led",
      "number": 6,
      "pins": [
        "H25"
      ],
      "direction": "o",
      "inverted": false,
      "connector": null,
      "attrs": {
        "IOSTANDARD": "LVCMOS15"
      }
    },
    {
      "name": "led",
      "number": 7,
      "pins": [
        "H24"
      ],
      "direction": "o",
      "inverted": false,
      "connector": null,
      "attrs": {
        "IOSTANDARD": "LVCMOS15"
      }
    }
  ],
  "buttons": [
    {
      "name": "button__n",
      "number": 0,
      "pins": [
        "Y23"
      ],
      "direction": "i",
      "inverted": false,
      "connector": null,
      "attrs": {
        "IOSTANDARD": "LVCMOS15"
      }
    }
  ],
  "switches": [],
  "seven_seg": null,
  "port_conventions": {
    "litex": {
      "description": "LiteX platform port names (auto-derived from the litex-boards _io file)",
      "clk": "clk100",
      "leds": {
        "name": "user_led_n",
        "width": 8,
        "active_low": true
      },
      "naming": "framework-derived",
      "buttons": {
        "name": "user_btn_n",
        "width": 1,
        "active_low": true
      }
    }
  },
  "$schema": "../schema/board.schema.json",
  "source": {
    "origin": "litex-boards",
    "upstream_file": "sitlinv_xc7k420t.py",
    "upstream_class": "Platform",
    "sync_commit": "8bf5de766fed9b89fdb265b17d2becc08039e9d1",
    "sync_timestamp": "2026-11-01T03:02:02.821936+00:00"
  }
}
