{
  "name": "Upduino V3",
  "class_name": "UpduinoV3Platform",
  "vendor": "Lattice",
  "device": "iCE40UP5K",
  "package": "SG48",
  "clocks": [
    12000000.0
  ],
  "default_clock_hz": 12000000.0,
  "leds": [
    {
      "name": "rgb_led",
      "number": 0,
      "pins": [
        "41",
        "39",
        "40"
      ],
      "direction": "o",
      "inverted": true,
      "connector": null,
      "attrs": {
        "IO_STANDARD": "SB_LVCMOS"
      }
    }
  ],
  "buttons": [],
  "switches": [],
  "seven_seg": null,
  "port_conventions": {},
  "$schema": "../schema/board.schema.json",
  "source": {
    "origin": "amaranth-boards",
    "upstream_file": "upduino_v3.py",
    "upstream_class": "UpduinoV3Platform",
    "sync_commit": "be069dfd490b31df215337afac35711994a52418",
    "sync_timestamp": "2026-10-31T23:32:50.118937+00:00"
  }
}
