{
  "name": "Mach XO2-7000 HE-Breakout",
  "class_name": "MachXO2_7000HE_BreakoutPlatform",
  "vendor": "Lattice",
  "device": "LCMXO2-7000HE",
  "package": "TG144",
  "clocks": [],
  "default_clock_hz": 2080000.0,
  "leds": [
    {
      "name": "led",
      "number": 0,
      "pins": [
        "97"
      ],
      "direction": "o",
      "inverted": true,
      "connector": null,
      "attrs": {}
    },
    {
      "name": "led",
      "number": 1,
      "pins": [
        "98"
      ],
      "direction": "o",
      "inverted": true,
      "connector": null,
      "attrs": {}
    },
    {
      "name": "led",
      "number": 2,
      "pins": [
        "99"
      ],
      "direction": "o",
      "inverted": true,
      "connector": null,
      "attrs": {}
    },
    {
      "name": "led",
      "number": 3,
      "pins": [
        "100"
      ],
      "direction": "o",
      "inverted": true,
      "connector": null,
      "attrs": {}
    },
    {
      "name": "led",
      "number": 4,
      "pins": [
        "104"
      ],
      "direction": "o",
      "inverted": true,
      "connector": null,
      "attrs": {}
    },
    {
      "name": "led",
      "number": 5,
      "pins": [
        "105"
      ],
      "direction": "o",
      "inverted": true,
      "connector": null,
      "attrs": {}
    },
    {
      "name": "led",
      "number": 6,
      "pins": [
        "106"
      ],
      "direction": "o",
      "inverted": true,
      "connector": null,
      "attrs": {}
    },
    {
      "name": "led",
      "number": 7,
      "pins": [
        "107"
      ],
      "direction": "o",
      "inverted": true,
      "connector": null,
      "attrs": {}
    }
  ],
  "buttons": [],
  "switches": [],
  "seven_seg": null,
  "port_conventions": {
    "amaranth": {
      "description": "amaranth-boards platform port names (auto-derived from the board .py file)",
      "clk": "OSCH",
      "leds": {
        "name": "led",
        "width": 8,
        "active_low": true
      },
      "naming": "framework-derived"
    }
  },
  "$schema": "../schema/board.schema.json",
  "source": {
    "origin": "amaranth-boards",
    "upstream_file": "machxo2_breakout.py",
    "upstream_class": "MachXO2_7000HE_BreakoutPlatform",
    "sync_commit": "be069dfd490b31df215337afac35711994a52418",
    "sync_timestamp": "2026-11-01T03:02:01.378669+00:00"
  }
}
